{
  "$schema": "http://json-schema.org/draft-04/schema#",
  "description": "Logbook page schema for the Arctic Pastfinder project",
  "type": "object",
  "required": [
    "title",
    "content",
    "logged_at",
    "category",
    "index",
    "url"
  ],
  "properties": {
    "title": {
      "type": "string"
    },
    "content": {
      "type": "string"
    },
    "logged_at": {
      "type": "string",
      "description": "Date of the logbook page",
      "pattern": "^[0-9]{4}-[0-9]{2}-[0-9]{2}$"
    },
    "category": {
      "type": "string"
    },
    "index": {
      "type": "integer"
    },
    "logbook": {
      "type": "object",
      "description": "subset of the logbook schema",
      "required": [
        "url"
      ],
      "properties": {
        "url": {
          "type": "string",
          "description": "URI Identifier url for resource instance"
        }
      }
    },
    "locations": {
      "type": "array",
      "minItems": 0,
      "uniqueItems": true,
      "items": {
        "type": "object",
        "required": [
          "type",
          "coordinates"
        ],
        "properties": {
          "type": {
            "type": "string"
          },
          "coordinates": {
            "type": "array",
            "minItems": 1,
            "uniqueItems": true,
            "items": {
              "type": "number"
            }
          }
        }
      }
    },
    "links": {
      "type": "array",
      "minItems": 0,
      "uniqueItems": true,
      "items": {
        "type": "object",
        "required": [
          "name",
          "url"
        ],
        "properties": {
          "name": {
            "type": "string"
          },
          "url": {
            "type": "string"
          }
        }
      }
    },
    "url": {
      "type": "string",
      "description": "URI Identifier url for resource instance"
    }
  }
}
